{
  "$schema": "../../../schemas/exam-profile.schema.json",
  "version": "1.0.0",
  "generatedAt": "2026-09-04",
  "id": "ib-so-ldce",
  "name": {
    "en": "Section Officers' Grade LDCE — Intelligence Bureau (ministerial cadre)",
    "hi": "अनुभाग अधिकारी ग्रेड सीमित विभागीय प्रतियोगी परीक्षा — आसूचना ब्यूरो (लिपिकीय संवर्ग)"
  },
  "organisation": {
    "en": "Intelligence Bureau, Ministry of Home Affairs (Category VIII)",
    "hi": "आसूचना ब्यूरो, गृह मंत्रालय (श्रेणी VIII)"
  },
  "examType": "ldce",
  "eligibilityNote": {
    "en": "Assistants and Stenographers Grade II (Personal Assistants) of the Intelligence Bureau: not less than four years' approved and continuous service where the officer was appointed on the result of a competitive or limited departmental competitive examination held not less than five years before the 1st July of the examination year, or not less than five years' approved and continuous service where appointed by seniority. NOTE: the notification names the Assistant and Stenographer grades — the ministerial cadre. It is NOT the examination for the executive line (Assistant Central Intelligence Officer and above); no public notification of a pattern for that line could be found, so this app carries none. Selection also counts a separate evaluation of record of service worth 100 marks, in which the notification requires a minimum of 40 per cent; the three written papers below carry 500 of the 600 total marks. This is a competitive examination, not a qualifying one.",
    "hi": "आसूचना ब्यूरो के सहायक तथा आशुलिपिक ग्रेड II (वैयक्तिक सहायक): जहाँ अधिकारी की नियुक्ति किसी प्रतियोगी अथवा सीमित विभागीय प्रतियोगी परीक्षा के परिणाम पर हुई हो जो परीक्षा वर्ष की 1 जुलाई से कम से कम पाँच वर्ष पूर्व आयोजित हुई हो, वहाँ कम से कम चार वर्ष की अनुमोदित एवं निरंतर सेवा; तथा जहाँ नियुक्ति वरिष्ठता के आधार पर हुई हो, वहाँ कम से कम पाँच वर्ष की अनुमोदित एवं निरंतर सेवा। टिप्पणी: अधिसूचना में सहायक तथा आशुलिपिक ग्रेड नामित हैं — अर्थात् लिपिकीय संवर्ग। यह कार्यकारी संवर्ग (सहायक केंद्रीय आसूचना अधिकारी तथा उससे ऊपर) की परीक्षा नहीं है; उस संवर्ग हेतु किसी पैटर्न की सार्वजनिक अधिसूचना नहीं मिल सकी, अतः इस ऐप में वह नहीं है। चयन में सेवा-अभिलेख का पृथक मूल्यांकन भी गिना जाता है, जो 100 अंकों का है और जिसमें अधिसूचना के अनुसार न्यूनतम 40 प्रतिशत अंक अनिवार्य हैं; नीचे दिए गए तीन लिखित प्रश्नपत्र कुल 600 में से 500 अंकों के हैं। यह प्रतियोगी परीक्षा है, अर्हक परीक्षा नहीं।"
  },
  "papers": [
    {
      "id": "paper-1",
      "name": {
        "en": "Paper I — General Studies and General Knowledge",
        "hi": "प्रश्नपत्र I — सामान्य अध्ययन तथा सामान्य ज्ञान"
      },
      "marks": 150,
      "durationMinutes": 120,
      "objective": true,
      "negativeMarking": 0.3333,
      "units": [
        {
          "id": "current-affairs",
          "name": {
            "en": "Current affairs, the Five Year Plans, the Indian economy and major developmental schemes",
            "hi": "सामयिक घटनाएँ, पंचवर्षीय योजनाएँ, भारतीय अर्थव्यवस्था तथा प्रमुख विकास योजनाएँ"
          },
          "coverage": {
            "external": true,
            "note": {
              "en": "Not in this app. A daily newspaper and the Ministry's own scheme pages are the sources the notification points at.",
              "hi": "इस ऐप में नहीं। अधिसूचना जिन स्रोतों की ओर संकेत करती है वे दैनिक समाचार पत्र तथा संबंधित मंत्रालय के योजना पृष्ठ हैं।"
            }
          },
          "weight": 0.2
        },
        {
          "id": "constitution",
          "name": {
            "en": "Principles of the Constitution of India",
            "hi": "भारत के संविधान के सिद्धांत"
          },
          "coverage": {
            "external": true,
            "note": {
              "en": "Not in this app. This app ships the criminal codes and the service rules, not the Constitution.",
              "hi": "इस ऐप में नहीं। यह ऐप दंड संहिताएँ तथा सेवा नियम रखता है, संविधान नहीं।"
            }
          },
          "weight": 0.2
        },
        {
          "id": "parliament-procedure",
          "name": {
            "en": "Rules of Procedure and Conduct of Business in the Lok Sabha and the Rajya Sabha",
            "hi": "लोक सभा तथा राज्य सभा में प्रक्रिया एवं कार्य संचालन के नियम"
          },
          "coverage": {
            "external": true,
            "note": {
              "en": "Not in this app. Both Houses publish their own Rules of Procedure.",
              "hi": "इस ऐप में नहीं। दोनों सदन अपनी प्रक्रिया-नियमावली स्वयं प्रकाशित करते हैं।"
            }
          },
          "weight": 0.2
        },
        {
          "id": "machinery-of-government",
          "name": {
            "en": "Organisation of the machinery of the Government of India — allocation of subjects between Ministries, Departments and attached and subordinate offices",
            "hi": "भारत सरकार के तंत्र का संगठन — मंत्रालयों, विभागों तथा संलग्न एवं अधीनस्थ कार्यालयों के बीच विषयों का आवंटन"
          },
          "coverage": {
            "external": true,
            "note": {
              "en": "Not in this app. The Government of India (Allocation of Business) Rules are the source.",
              "hi": "इस ऐप में नहीं। इसका स्रोत भारत सरकार (कार्य आवंटन) नियम हैं।"
            }
          },
          "weight": 0.2
        },
        {
          "id": "rti-act",
          "name": {
            "en": "The Right to Information Act, 2005",
            "hi": "सूचना का अधिकार अधिनियम, 2005"
          },
          "coverage": [
            {
              "act": "rti"
            }
          ],
          "weight": 0.2
        }
      ]
    },
    {
      "id": "paper-2",
      "name": {
        "en": "Paper II — Procedure and practice in the Government of India Secretariat, and General Financial and Service Rules",
        "hi": "प्रश्नपत्र II — भारत सरकार सचिवालय में प्रक्रिया एवं कार्यपद्धति, तथा सामान्य वित्तीय एवं सेवा नियम"
      },
      "marks": 150,
      "durationMinutes": 120,
      "objective": true,
      "negativeMarking": 0.3333,
      "units": [
        {
          "id": "manual-of-office-procedure",
          "name": {
            "en": "Manual of Office Procedure (latest edition)",
            "hi": "कार्यालय प्रक्रिया नियमावली (नवीनतम संस्करण)"
          },
          "coverage": [
            {
              "act": "csmop"
            }
          ],
          "weight": 0.1
        },
        {
          "id": "istm-office-procedure-notes",
          "name": {
            "en": "Notes on office procedure issued by the Institute of Secretariat Training and Management",
            "hi": "सचिवालय प्रशिक्षण एवं प्रबंधन संस्थान द्वारा जारी कार्यालय प्रक्रिया संबंधी टिप्पणियाँ"
          },
          "coverage": {
            "external": true,
            "note": {
              "en": "ISTM publishes this reading material itself; it is not a rule book this app ships.",
              "hi": "यह पठन-सामग्री आईएसटीएम स्वयं प्रकाशित करता है; यह इस ऐप में उपलब्ध नियम-पुस्तक नहीं है।"
            }
          },
          "weight": 0.1
        },
        {
          "id": "fundamental-and-supplementary-rules",
          "name": {
            "en": "Fundamental and Supplementary Rules",
            "hi": "मूल तथा अनुपूरक नियम"
          },
          "coverage": [
            {
              "act": "fr-sr"
            }
          ],
          "weight": 0.1
        },
        {
          "id": "ccs-pension-rules",
          "name": {
            "en": "The Central Civil Services (Pension) Rules",
            "hi": "केंद्रीय सिविल सेवा (पेंशन) नियम"
          },
          "coverage": [
            {
              "act": "ccs-pension"
            }
          ],
          "weight": 0.1
        },
        {
          "id": "ccs-conduct-rules",
          "name": {
            "en": "The Central Civil Services (Conduct) Rules",
            "hi": "केंद्रीय सिविल सेवा (आचरण) नियम"
          },
          "coverage": [
            {
              "act": "ccs-conduct"
            }
          ],
          "weight": 0.1
        },
        {
          "id": "ccs-cca-rules",
          "name": {
            "en": "The Central Civil Services (Classification, Control and Appeal) Rules",
            "hi": "केंद्रीय सिविल सेवा (वर्गीकरण, नियंत्रण तथा अपील) नियम"
          },
          "coverage": [
            {
              "act": "ccs-cca"
            }
          ],
          "weight": 0.1
        },
        {
          "id": "ccs-leave-rules",
          "name": {
            "en": "The Central Civil Services (Leave) Rules",
            "hi": "केंद्रीय सिविल सेवा (अवकाश) नियम"
          },
          "coverage": [
            {
              "act": "ccs-leave"
            }
          ],
          "weight": 0.1
        },
        {
          "id": "general-financial-rules",
          "name": {
            "en": "Compilation of the General Financial Rules",
            "hi": "सामान्य वित्तीय नियमों का संकलन"
          },
          "coverage": [
            {
              "act": "gfr"
            }
          ],
          "weight": 0.1
        },
        {
          "id": "delegation-of-financial-powers-rules",
          "name": {
            "en": "Delegation of Financial Powers Rules",
            "hi": "वित्तीय शक्तियों का प्रत्यायोजन नियम"
          },
          "coverage": {
            "external": true,
            "note": {
              "en": "Not in this app. The Department of Expenditure publishes these rules; this app ships the General Financial Rules but not the delegation rules.",
              "hi": "इस ऐप में नहीं। ये नियम व्यय विभाग प्रकाशित करता है; इस ऐप में सामान्य वित्तीय नियम हैं, प्रत्यायोजन नियम नहीं।"
            }
          },
          "weight": 0.1
        },
        {
          "id": "intelligence-bureau-standing-orders",
          "name": {
            "en": "Intelligence Bureau Standing Orders",
            "hi": "आसूचना ब्यूरो स्थायी आदेश"
          },
          "coverage": {
            "external": true,
            "note": {